{
  "meta": {
    "schema_version": "1.0.0",
    "dataset_version": "example-1.0.0",
    "generated_at": "2024-01-01T00:00:00Z",
    "language": "nl",
    "source": {
      "title": "HBO-i Domeinbeschrijving - Voorbeeld Dataset",
      "publisher": "HBO-i",
      "year": 2024,
      "isbn": "978-90-834007-1-6",
      "license": "CC BY-NC-ND",
      "license_url": "https://creativecommons.org/licenses/by-nc-nd/4.0/",
      "document_url": "https://www.hbo-i.nl"
    }
  },
  "beheersingsniveaus": [
    {
      "id": 1,
      "naam": "Taakgericht",
      "beschrijving": "Werkt onder algemene richtlijnen in een omgeving waar onvoorspelbare veranderingen optreden.",
      "beschrijving_canoniek": "Werkt onder algemene richtlijnen in een omgeving waar onvoorspelbare veranderingen optreden.",
      "bron": {
        "pagina": 8,
        "sectie": "2.1 Beheersingsniveaus"
      },
      "criteria": {
        "zelfstandigheid": "Werkt onder algemene richtlijnen in een omgeving waar onvoorspelbare veranderingen optreden.",
        "complexiteit_context": "Gestructureerd - voorspelbare context, probleem gedefinieerd, aanpak en oplossing bekend bij opdrachtgever.",
        "complexiteit_inhoud": "Enkele basisconcepten die voortbouwen op vooropleiding."
      }
    },
    {
      "id": 2,
      "naam": "Probleemgericht",
      "beschrijving": "Lost zelfstandig interactieve vraagstukken op die voortkomen uit projectactiviteiten.",
      "criteria": {
        "zelfstandigheid": "Lost zelfstandig interactieve vraagstukken op die voortkomen uit projectactiviteiten.",
        "complexiteit_context": "Gestructureerd - onvoorspelbare context, probleem gegeven, keuze van aanpak en oplossingsruimte beperkt.",
        "complexiteit_inhoud": "Combinatie van meerdere basisconcepten en enkele verdiepingsconcepten die voortbouwen op basisconcepten."
      }
    },
    {
      "id": 3,
      "naam": "Situatiegericht",
      "beschrijving": "Werkt zelfstandig om interactieve problemen op te lossen. Heeft een positief effect op teamprestaties.",
      "criteria": {
        "zelfstandigheid": "Werkt zelfstandig om interactieve problemen op te lossen. Heeft een positief effect op teamprestaties.",
        "complexiteit_context": "Gestructureerd - onvoorspelbare context, vage problemen, aanpak en oplossingsruimte open.",
        "complexiteit_inhoud": "Combinatie van meerdere concepten voor verdieping en innovatie in de lokale situatie."
      }
    },
    {
      "id": 4,
      "naam": "Professiegericht",
      "beschrijving": "Coördineert en stuurt. Pakt vraagstukken aan met veel interacterende factoren.",
      "criteria": {
        "zelfstandigheid": "Coördineert en stuurt. Pakt vraagstukken aan met veel interacterende factoren.",
        "complexiteit_context": "Ongestructureerd multidisciplinair en/of specialistisch context.",
        "complexiteit_inhoud": "Nieuwe concepten voor verdieping en innovatie die overdraagbaar zijn naar andere situaties."
      }
    }
  ],
  "activiteiten": [
    {
      "id": "act.analyseren",
      "naam": "Analyseren",
      "beschrijving": "Het analyseren van processen, producten en informatiestromen in hun onderlinge samenhang en context.",
      "koppelingen": {
        "ecf_areas": ["Plan"],
        "sfia_note": "Analyse en requirements engineering",
        "ecf_context": "e-CF dimension 1 (areas): de activiteit 'analyseren' valt grofweg binnen een deel van het 'area' 'Plan' onderscheiden binnen dimension 1."
      },
      "kwaliteitsaspecten": ["security", "budget", "tijd", "duurzaamheid"]
    },
    {
      "id": "act.adviseren",
      "naam": "Adviseren",
      "beschrijving": "Het adviseren over de inrichting van processen en/of informatie voor een nieuw te ontwikkelen, aan te schaffen of aan te passen ICT-systeem.",
      "koppelingen": {
        "ecf_areas": ["Plan"],
        "sfia_note": "Business analysis en consultancy",
        "ecf_context": "e-CF dimension 1 (areas): de activiteit 'adviseren' valt grofweg binnen een deel van het 'area' 'Plan' onderscheiden binnen dimension 1."
      },
      "kwaliteitsaspecten": ["security", "budget", "tijd", "duurzaamheid"]
    },
    {
      "id": "act.ontwerpen",
      "naam": "Ontwerpen",
      "beschrijving": "Het ontwerpen van een (onderdeel van een) ICT-systeem op basis van requirements.",
      "koppelingen": {
        "ecf_areas": ["Plan", "Build"],
        "sfia_note": "Solution architecture en design",
        "ecf_context": "e-CF dimension 1 (areas): de activiteit 'ontwerpen' valt grofweg binnen een deel van het 'area' 'Plan' onderscheiden binnen dimension 1."
      },
      "kwaliteitsaspecten": ["security", "budget", "tijd", "duurzaamheid"]
    },
    {
      "id": "act.realiseren",
      "naam": "Realiseren",
      "beschrijving": "Het realiseren en testen van een (onderdeel van een) ICT-systeem op basis van een ontwerp.",
      "koppelingen": {
        "ecf_areas": ["Build"],
        "sfia_note": "Development en implementation",
        "ecf_context": "e-CF dimension 1 (areas): de activiteit 'realiseren' valt grofweg binnen het 'area' 'Build' onderscheiden binnen dimension 1."
      },
      "kwaliteitsaspecten": ["security", "budget", "tijd", "duurzaamheid"]
    },
    {
      "id": "act.manage_control",
      "naam": "Manage & Control",
      "beschrijving": "Het beheren, monitoren en optimaliseren van de ontwikkeling, ingebruikname en het gebruik van ICT-systemen.",
      "koppelingen": {
        "ecf_areas": ["Run"],
        "sfia_note": "Service management en operations",
        "ecf_context": "e-CF dimension 1 (areas): de activiteit 'manage & control' valt overwegend binnen het 'area' 'Run' onderscheiden binnen dimension 1."
      },
      "kwaliteitsaspecten": ["security", "budget", "tijd", "duurzaamheid"]
    }
  ],
  "architectuurlagen": [
    {
      "id": "arch.gebruikersinteractie",
      "naam": "Gebruikersinteractie",
      "beschrijving": "Communicatie tussen de (eind)gebruiker en het ICT-systeem. Dit betreft niet de interactie met gebruikers tijdens de ontwikkeling van een ICT-systeem, aangezien dat relevant is voor alle architectuurlagen.",
      "activiteit_niveau_beschrijvingen": [
        {
          "activiteit_id": "act.analyseren",
          "beheersingsniveau_id": 1,
          "beschrijving": "Identificeren van de kernelementen van een externe opdracht waarbij verduidelijking wordt gezocht bij opdrachtgever, eindgebruikers en experts"
        },
        {
          "activiteit_id": "act.analyseren",
          "beheersingsniveau_id": 2,
          "beschrijving": "Benchmarken van functionaliteit, gebruikerservaring, toegankelijkheid, en andere ontwerpaspecten voor een opdrachtgever"
        },
        {
          "activiteit_id": "act.analyseren",
          "beheersingsniveau_id": 3,
          "beschrijving": "Analyseren van de eindgebruiker en gebruikersinteractie en -ervaring, zowel individueel (fysiek, psychologisch, persoonlijke karakteristieken) als in grotere maatschappelijke context (sociaal, cultureel, ethisch, technologisch)"
        },
        {
          "activiteit_id": "act.analyseren",
          "beheersingsniveau_id": 4,
          "beschrijving": "Analyseren van maatschappelijke en/of domeinspecifieke trends & kansen en hierover op strategisch niveau communiceren met de key stakeholders"
        },
        {
          "activiteit_id": "act.adviseren",
          "beheersingsniveau_id": 1,
          "beschrijving": "Inventariseren van opdrachtgevers- en eindgebruikersbehoeften en deze vertalen naar ict-middelen"
        },
        {
          "activiteit_id": "act.adviseren",
          "beheersingsniveau_id": 2,
          "beschrijving": "Analyseren van bestaande producten of diensten in relatie tot gebruikersbehoeften en kernwaarden van de opdrachtgever"
        },
        {
          "activiteit_id": "act.adviseren",
          "beheersingsniveau_id": 3,
          "beschrijving": "Inventariseren van relevante data-visualisaties voor een dataset"
        },
        {
          "activiteit_id": "act.adviseren",
          "beheersingsniveau_id": 4,
          "beschrijving": "Doorlopend evalueren van het effect van de interventie op de gebruikerservaring"
        }
      ]
    },
    {
      "id": "arch.organisatieprocessen",
      "naam": "Organisatieprocessen",
      "beschrijving": "Het faciliteren van organisatieprocessen door middel van ICT-systemen. Het gaat om de functionaliteit van het systeem als geheel (geautomatiseerde en niet-geautomatiseerde delen), bezien vanuit de context van de te behalen organisatiedoelen.",
      "activiteit_niveau_beschrijvingen": [
        {
          "activiteit_id": "act.analyseren",
          "beheersingsniveau_id": 1,
          "beschrijving": "Analyseren van een enkel(e) organisatie, organisatieproces of procesbesturing op operationeel niveau met bijbehorende gegevensstromen en (gestructureerde) databehoeften"
        },
        {
          "activiteit_id": "act.analyseren",
          "beheersingsniveau_id": 1,
          "sub_aspect": "Knelpunten en oorzaak-gevolgrelaties",
          "beschrijving": "Analyseren van knelpunten en oorzaak-gevolgrelaties vanuit de invalshoek van de informatievoorziening"
        },
        {
          "activiteit_id": "act.analyseren",
          "beheersingsniveau_id": 1,
          "sub_aspect": "ICT-mogelijkheden",
          "beschrijving": "Analyseren van beschikbare ict-mogelijkheden in het veld"
        },
        {
          "activiteit_id": "act.analyseren",
          "beheersingsniveau_id": 2,
          "beschrijving": "Analyseren van meerdere operationele en tactische organisatieprocessen, inclusief kwaliteit van de bijbehorende data en van de huidige en toekomstige ict-voorziening"
        },
        {
          "activiteit_id": "act.analyseren",
          "beheersingsniveau_id": 2,
          "sub_aspect": "Samenhang knelpunten",